{
  "category": "ai",
  "count": 74492,
  "fetchedAt": "2026-10-24",
  "nameKo": "AI 확장",
  "subcategories": [
    {
      "count": 5462,
      "descKo": "SKILL.md 한 폴더로 된 능력 묶음. Claude Code·Codex·Copilot 같은 에이전트가 필요할 때 불러 쓴다.",
      "id": "skill",
      "nameKo": "에이전트 스킬",
      "sources": [
        {
          "available": 40060,
          "count": 2812,
          "cut": "설치 25회 이상 또는 저장소 별 1000개 이상",
          "file": "skill-cpd.json",
          "id": "skill-cpd",
          "license": "공개 API 메타데이터 (각 스킬은 원 저장소 라이선스)",
          "name": "Claude Plugins (claude-plugins.dev)",
          "url": "https://claude-plugins.dev/skills"
        },
        {
          "available": 1159,
          "count": 1106,
          "file": "skill-awesome-agent.json",
          "id": "skill-awesome-agent",
          "license": "MIT",
          "name": "Awesome Agent Skills",
          "url": "https://github.com/VoltAgent/awesome-agent-skills"
        },
        {
          "available": 892,
          "count": 841,
          "file": "skill-aitmpl.json",
          "id": "skill-aitmpl",
          "license": "MIT (davila7/claude-code-templates)",
          "name": "Claude Code Templates (skills)",
          "url": "https://www.aitmpl.com"
        },
        {
          "available": 442,
          "count": 441,
          "file": "skill-copilot.json",
          "id": "skill-copilot",
          "license": "MIT",
          "name": "Awesome GitHub Copilot (skills)",
          "url": "https://github.com/github/awesome-copilot"
        },
        {
          "available": 249,
          "count": 243,
          "file": "skill-toolhive.json",
          "id": "skill-toolhive",
          "license": "Apache-2.0 (등록소 자료), 각 스킬은 원 저장소 라이선스",
          "name": "ToolHive Registry (skills)",
          "url": "https://github.com/stacklok/toolhive-registry"
        },
        {
          "available": 19,
          "count": 19,
          "file": "skill-anthropic.json",
          "id": "skill-anthropic",
          "license": "스킬마다 LICENSE.txt (Apache-2.0 또는 소스 공개 전용). 메타데이터(이름·설명)는 저장소 SKILL.md 머리말",
          "name": "Anthropic Agent Skills",
          "url": "https://github.com/anthropics/skills"
        }
      ]
    },
    {
      "count": 52277,
      "descKo": "AI 에이전트에 도구와 자료를 이어 주는 MCP(Model Context Protocol) 서버.",
      "id": "mcp",
      "nameKo": "MCP 서버",
      "sources": [
        {
          "available": 49613,
          "count": 48371,
          "cut": "활성(active) 최신판만",
          "file": "mcp-registry.json",
          "id": "mcp-registry",
          "license": "공개 등록소 API (게시자가 올린 server.json 메타데이터, 재배포를 위한 공개 API)",
          "name": "Official MCP Registry",
          "url": "https://registry.modelcontextprotocol.io"
        },
        {
          "available": 4362,
          "count": 1964,
          "file": "mcp-awesome.json",
          "id": "mcp-awesome",
          "license": "MIT",
          "name": "awesome-mcp-servers",
          "url": "https://github.com/punkpeye/awesome-mcp-servers"
        },
        {
          "available": 490,
          "count": 490,
          "file": "mcp-github.json",
          "id": "mcp-github",
          "license": "공개 API (api.mcp.github.com) 메타데이터, 원문은 각 저장소 라이선스",
          "name": "GitHub MCP Registry",
          "url": "https://github.com/mcp"
        },
        {
          "available": 20785,
          "count": 429,
          "cut": "API가 내주는 사용량 순 상위 500개",
          "file": "mcp-smithery.json",
          "id": "mcp-smithery",
          "license": "공개 등록소 API (registry.smithery.ai) 메타데이터",
          "name": "Smithery",
          "url": "https://smithery.ai"
        },
        {
          "available": 328,
          "count": 291,
          "cut": "보관(Archived) 표시 서버 제외",
          "file": "mcp-docker.json",
          "id": "mcp-docker",
          "license": "MIT (docker/mcp-registry)",
          "name": "Docker MCP Catalog",
          "url": "https://github.com/docker/mcp-registry"
        },
        {
          "available": 389,
          "count": 286,
          "file": "mcp-mcpm.json",
          "id": "mcp-mcpm",
          "license": "MIT",
          "name": "MCPM registry",
          "url": "https://github.com/pathintegral-institute/mcpm.sh"
        },
        {
          "available": 482,
          "count": 198,
          "file": "mcp-wong2.json",
          "id": "mcp-wong2",
          "license": "MIT",
          "name": "mcpservers.org (awesome-mcp-servers)",
          "url": "https://github.com/wong2/awesome-mcp-servers"
        },
        {
          "available": 107,
          "count": 93,
          "file": "mcp-aitmpl.json",
          "id": "mcp-aitmpl",
          "license": "MIT (davila7/claude-code-templates)",
          "name": "Claude Code Templates (MCP)",
          "url": "https://www.aitmpl.com"
        },
        {
          "available": 125,
          "count": 79,
          "file": "mcp-remote.json",
          "id": "mcp-remote",
          "license": "MIT",
          "name": "Awesome Remote MCP Servers",
          "url": "https://github.com/jaw9c/awesome-remote-mcp-servers"
        },
        {
          "available": 111,
          "count": 69,
          "file": "mcp-toolhive.json",
          "id": "mcp-toolhive",
          "license": "Apache-2.0",
          "name": "ToolHive Registry",
          "url": "https://github.com/stacklok/toolhive-registry"
        },
        {
          "available": 7,
          "count": 7,
          "file": "mcp-reference.json",
          "id": "mcp-reference",
          "license": "MIT (저장소 README·패키지 정보)",
          "name": "MCP Reference Servers",
          "url": "https://github.com/modelcontextprotocol/servers"
        }
      ]
    },
    {
      "count": 8809,
      "descKo": "스킬·명령·에이전트·MCP 설정을 한데 묶어 한 번에 설치하는 코딩 에이전트 플러그인과 확장.",
      "id": "plugin",
      "nameKo": "플러그인·확장",
      "sources": [
        {
          "available": 55600,
          "count": 2632,
          "cut": "내려받기 50회 이상 또는 저장소 별 1000개 이상",
          "file": "plugin-cpd.json",
          "id": "plugin-cpd",
          "license": "공개 API 메타데이터 (각 플러그인은 원 저장소 라이선스)",
          "name": "Claude Plugins (claude-plugins.dev)",
          "url": "https://claude-plugins.dev/plugins"
        },
        {
          "available": 2283,
          "count": 2283,
          "file": "plugin-claude-community.json",
          "id": "plugin-claude-community",
          "license": "Apache-2.0 (마켓 목록), 각 플러그인은 원 저장소 라이선스",
          "name": "Claude Plugins Community (Anthropic)",
          "url": "https://github.com/anthropics/claude-plugins-community"
        },
        {
          "available": 2198,
          "count": 2194,
          "file": "plugin-gemini.json",
          "id": "plugin-gemini",
          "license": "공개 갤러리 JSON (geminicli.com/extensions.json). 각 확장은 원 저장소 라이선스",
          "name": "Gemini CLI Extensions",
          "url": "https://geminicli.com/extensions/"
        },
        {
          "available": 1000,
          "count": 1000,
          "file": "plugin-dify.json",
          "id": "plugin-dify",
          "license": "공개 마켓 API (marketplace.dify.ai) 메타데이터와 링크만 싣는다",
          "name": "Dify Marketplace",
          "url": "https://marketplace.dify.ai"
        },
        {
          "available": 315,
          "count": 315,
          "file": "plugin-claude-official.json",
          "id": "plugin-claude-official",
          "license": "Apache-2.0 (마켓 목록), 각 플러그인은 원 저장소 라이선스",
          "name": "Claude Plugins Official",
          "url": "https://github.com/anthropics/claude-plugins-official"
        },
        {
          "available": 184,
          "count": 184,
          "file": "plugin-copilot.json",
          "id": "plugin-copilot",
          "license": "MIT",
          "name": "Awesome GitHub Copilot (plugins)",
          "url": "https://github.com/github/awesome-copilot"
        },
        {
          "available": 123,
          "count": 123,
          "file": "plugin-knowledge-work.json",
          "id": "plugin-knowledge-work",
          "license": "Apache-2.0",
          "name": "Knowledge Work Plugins (Anthropic)",
          "url": "https://github.com/anthropics/knowledge-work-plugins"
        },
        {
          "available": 65,
          "count": 65,
          "file": "plugin-codex.json",
          "id": "plugin-codex",
          "license": "플러그인마다 plugin.json의 license",
          "name": "OpenAI Codex Plugins",
          "url": "https://github.com/openai/plugins"
        },
        {
          "available": 13,
          "count": 13,
          "file": "plugin-claude-code.json",
          "id": "plugin-claude-code",
          "license": "저장소 LICENSE.md (Anthropic 상용 약관) 아래 공개 목록. 이름·설명·주소만 싣는다",
          "name": "Claude Code Plugins (Anthropic)",
          "url": "https://github.com/anthropics/claude-code/tree/main/plugins"
        }
      ]
    },
    {
      "count": 932,
      "descKo": "역할 하나를 맡기는 에이전트 정의 파일(.md). Claude Code 서브에이전트, Copilot 사용자 에이전트.",
      "id": "subagent",
      "nameKo": "서브에이전트",
      "sources": [
        {
          "available": 222,
          "count": 219,
          "file": "agent-copilot.json",
          "id": "agent-copilot",
          "license": "MIT",
          "name": "Awesome GitHub Copilot (agents)",
          "url": "https://github.com/github/awesome-copilot"
        },
        {
          "available": 422,
          "count": 195,
          "file": "agent-aitmpl.json",
          "id": "agent-aitmpl",
          "license": "MIT (davila7/claude-code-templates)",
          "name": "Claude Code Templates (agents)",
          "url": "https://www.aitmpl.com"
        },
        {
          "available": 163,
          "count": 163,
          "file": "agent-voltagent.json",
          "id": "agent-voltagent",
          "license": "MIT",
          "name": "Awesome Claude Code Subagents (VoltAgent)",
          "url": "https://github.com/VoltAgent/awesome-claude-code-subagents"
        },
        {
          "available": 202,